<!--;;;;;;;;;;;;;;;;;;;;;;;;;;;;;;;;;;;;;;;;;;;;;;;;;;;;;;;;;;;;;;;;;;;;;;;;-->
<!--                                                                        -->
<!-- Title:         Berlioz DTD for Web Services                            -->
<!-- System:        Berlioz                                                 -->
<!-- Status:        Beta 5                                                  -->
<!-- Description:   A schema for the defining the URL patterns and          -->
<!--                associated content generators.                          -->
<!-- Version:       1.0                                                     -->
<!-- LastModified:  6 June 2026                                             -->
<!-- Author(s):     Christophe Lauret                                       -->
<!--                                                                        -->
<!--;;;;;;;;;;;;;;;;;;;;;;;;;;;;;;;;;;;;;;;;;;;;;;;;;;;;;;;;;;;;;;;;;;;;;;;;-->

<!-- A URI Pattern as defined in the URI Template specifications            -->
<!ENTITY  % URI_PATTERN      "CDATA"                                          >

<!-- The HTTP method for the associated service                             -->
<!ENTITY  % HTTP_METHOD      "(get | put | delete | post | patch)"            >

<!-- The rule to use to compute the response code                           -->
<!ENTITY  % CODE_RULE        "(highest | lowest | first)"                     >

<!-- The Boolean true|false                                                 -->
<!ENTITY  % BOOLEAN          "(true | false)"                                 >

<!--
  Top level element.

  @attribute version The version of service configuration always "1.0"
-->
<!ELEMENT service-config                        ( response-code?, services* ) >
<!ATTLIST service-config     version            CDATA            #FIXED "1.0" >

<!--
  A container for services.

  @attribute group A name to group these services together.
-->
<!ELEMENT services                               ( response-code?, service* ) >
<!ATTLIST services           group              NMTOKEN             #REQUIRED >

<!--
  A service composed of multiple generators and matching at least one URL.

  @attribute id     A unique identifier for this service.
  @attribute method The HTTP method this service accepts.
  @attribute flags  A list of values that can be used to qualify the service
  @attribute cache-control The cache-control header value
-->
<!ELEMENT service                        ( url+, response-code?, generator* ) >
<!ATTLIST service            id                 ID                  #REQUIRED
                             method             %HTTP_METHOD;       #REQUIRED
                             flags              NMTOKENS             #IMPLIED
                             direct             %BOOLEAN;            #IMPLIED
                             cache-control      CDATA                #IMPLIED >

<!--
  The URL pattern matching this service.

  @attribute pattern The URI Pattern for this URL.
-->
<!ELEMENT url                                                           EMPTY >
<!ATTLIST url                pattern            %URI_PATTERN;       #REQUIRED >

<!--
  The content generator.

  The class must implement the ContentGenerator interface defined in Berlioz.
  When omitted, the NoContent generator is used.

  The name and target are preserved and can be used in the XSLT to determine
  what to do with the generated content.

  @attribute class  The fully qualified Java class to load for this generator;
                    defaults to NoContent when omitted.
  @attribute name   A name for this generator.
  @attribute target A target for the content generated in the output.
-->
<!ELEMENT generator                                            ( parameter* ) >
<!ATTLIST generator         class               CDATA                #IMPLIED
                            name                NMTOKEN              #IMPLIED
                            target              NMTOKEN              #IMPLIED >

<!--
  A parameter to pass to the content generator.

  @attribute name    The name of the parameter.
  @attribute value   The value of this parameter.
-->
<!ELEMENT parameter                                                    EMPTY >
<!ATTLIST parameter         name               CDATA               #REQUIRED
                            value              CDATA               #REQUIRED >

<!--
  Defines how the HTTP response code is determined when multiple generators
  return different codes.

  @attribute use   The default response code to use.
  @attribute rule  The rule to apply when generators return different codes.
-->
<!ELEMENT response-code                                                EMPTY >
<!ATTLIST response-code     use                CDATA               #REQUIRED
                            rule               %CODE_RULE;          #IMPLIED >
