<?xml version="1.0" encoding="utf-8"?>
<!DOCTYPE service-config PUBLIC "-//Berlioz//DTD::Services 1.0//EN"
    "https://pageseeder.org/schema/berlioz/services-1.0.dtd">
<service-config version="1.0">

  <services group="default">
    <service id="first" method="get">
      <url pattern="/dup"/>
      <generator class="org.pageseeder.berlioz.generator.NoContent"/>
    </service>
    <service id="second" method="get">
      <url pattern="/dup"/>
      <generator class="org.pageseeder.berlioz.generator.NoContent"/>
    </service>
  </services>

</service-config>
